data/intermediate/chunks/grade7/maths/part1/chapter3/3.8_More_on_the_Decimal_System.json

{
  "grade": 7,
  "subject": "maths",
  "chapter_number": 3,
  "chapter_title": "A PEEK BEYOND THE POINT",
  "topic_number": "3.8",
  "topic_title": "More on the Decimal System",
  "depth": 2,
  "page_start": 31,
  "content": "Decimal and Measurement Disasters\nDecimal point and unit conversion mistakes may seem minor sometimes\nbut they can lead to serious problems. Here are some actual incidents\nin which such errors caused major issues.\nA Peek Beyond the Point\n•\t In 2013, the finance office of Amsterdam City Council (Netherlands)\nmistakenly sent out €188 million in housing benefits instead of the\nintended €1.8 million due to a programming error that processed\npayments in euro cents instead of euros. (1 euro-cent = 1/100\neuro).\n•\t In 1983, a decimal error nearly caused a disaster for an Air Canada\nBoeing 767. The ground staff miscalculated the fuel, loading 22,300\npounds instead of kilograms—about half of what was needed (1\npound ~ 0.453 kg). The plane ran out of fuel mid-air, forcing the\npilots to make an emergency landing at an abandoned airfield.\nFortunately, everyone survived.\nSeveral incidents have occurred due to incorrect reading of decimal\nnumbers while giving medication. For example, reading 0.05 mg as 0.5\nmg can lead to using a medicine 10 times more than the prescribed\nquantity. It is therefore important to pay attention to units and the\nlocation of the decimal point.\nDeceptive Decimal Notation\nSarayu gets a message: “The bus will reach the station 4.5 hours post\nnoon.” When will the bus reach the station: 4:05 p.m., 4:50 p.m., 4:25 p.m.?\nNone of these! Here, 0.5 hours means splitting an hour into 10\nequal parts and taking 5 parts out of it. Each part will be 6 minutes (60\nminutes/10) long. 5 such parts make 30 minutes. So, the bus will reach\nthe station at 4:30.\nHere is a short-story of a decimal mishap: A girl measures the width\nof an opening as 2 ft 5 inches but conveys to the carpenter to make a\ndoor 2.5 ft wide. The carpenter makes a door of width 2 ft 6 inches\n(since 1 ft = 12 inches, 0.5 ft = 6 inches), and it wouldn’t close fully.\nI said the door’s\nwidth should be\n2.5 ft.\nIt is 2.5 ft! You\ncan verify.\nGanita Prakash | Grade 7\nIf you watch cricket, you might have noticed decimal-looking\nnumbers like ‘Overs left: 5.5’. Does this mean 5 overs and 5 balls or 5\novers and 3 balls? Here, 5.5 overs means 5 5\n6 overs (as 1 over = 6 balls),\ni.e., 5 overs and 5 balls.\nWhere else can we see such ‘non-decimals’ with a decimal-like\nnotation?\nA Pinch of History – Decimal Notation Over Time\nDecimal fractions (i.e., fractions with denominators like 1\n10 ,\n100 ,\n1000 , and so on) are used in the works of a number of ancient Indian\nastronomers and mathematicians, including in the important 8th\ncentury works of Śhrīdharāchārya on arithmetic and algebra. Decimal\nnotation, in essentially its modern form, was described in detail in\nKitāb al-Fuṣūl fī al-Ḥisāb al Hindī (The Book of Chapters on Indian\nArithmetic) by Abūl Ḥassan al-Uqlīdisī, an Arab mathematician, in\naround 950 CE. He represented the number 0.059375 as 0ˈ 059375.\nIn the 15th century, to separate whole numbers from fractional\nparts, a number of different notations were used:\n•\t a vertical mark on the last digit of the whole number part (as\nshown above),\n•\t use of different colours and\n•\t a numerical superscript giving the number of fractional decimal\nplaces (0.36 would be written as 36\n).\nIn the 16th century, John Napier, a Scottish mathematician, and\nChristopher Clavius, a German mathematician, used the point/period\n(‘.’) to separate the whole number and the fractional parts, while\nFrançois Viète, a French mathematician, used the comma (‘,’) instead.\nCurrently, several countries use the comma to separate the integer\npart and the fractional part. In these countries, the number 1,000.5\nis written as 1 000,5 (space as a thousand separator). But the decimal\npoint has endured as the most popular notation for writing numbers\nhaving fractional parts in the Indian place value system.\nFigure it Out\n1.\t \tConvert the following fractions into decimals:\n(a)\n(b)\n(c)\n(d)\nMath\nTalk\nA Peek Beyond the Point\n2.\t \tConvert the following decimals into a sum of tenths, hundredths\nand thousandths:\n(a)\t 0.34\n(b)\t 1.02\n(c)\n0.8\n(d)\t 0.362\n3.\t \tWhat decimal number does each letter represent in the number\nline below?\nb\na\nc\n6.6\n6.5\n6.4\n4.\t \tArrange the following quantities in descending order:\n(a)\t 11.01, 1.011, 1.101, 11.10, 1.01\n(b)\t 2.567, 2.675, 2.768, 2.499, 2.698\n(c)\t 4.678 g, 4.595 g, 4.600 g, 4.656 g, 4.666 g\n(d)\t 33.13 m, 33.31 m, 33.133 m, 33.331 m, 33.313 m\n5.\t \tUsing the digits 1, 4, 0, 8, and 6 make:\n(a)\t the decimal number closest to 30\n(b)\t the smallest possible decimal number between 100 and 1000.\n6.\t \tWill a decimal number with more digits be greater than a decimal\nnumber with fewer digits?\n7.\t \tMahi purchases 0.25 kg of beans, 0.3 kg of carrots, 0.5 kg of potatoes,\n0.2 kg of capsicums, and 0.05 kg of ginger. Calculate the total weight\nof the items she bought.\n8.\t \tPinto supplies 3.79 L, 4.2 L, and 4.25 L of milk to a milk dairy in\nthe first three days. In 6 days, he supplies 25 litres of milk. Find the\ntotal quantity of milk supplied to the dairy in the last three days.\n9.\t \tTinku weighed 35.75 kg in January and 34.50 kg in February. Has\nhe gained or lost weight? How much is the change?\n10.\t\tExtend the pattern: 5.5, 6.4, 6.39, 7.29, 7.28, 6.18, 6.17, ____,  _____\n11.\t\tHow many millimeters make 1 kilometer?\n12.\t\tIndian Railways offers optional travel insurance for passengers\nwho book e-tickets. It costs 45 paise per passenger. If 1 lakh people\nopt for insurance in a day, what is the total insurance fee paid?\n13.\t\tWhich is greater?\n(a)\t \t 10\n1000 or 1\n10 ?\nGanita Prakash | Grade 7\n(b)\t \tOne-hundredth or 90 thousandths?\n(c)\t \tOne-thousandth or 90 hundredths?\n14.\t\tWrite the decimal forms of the quantities mentioned (an example\nis given):\n(a)\t \t87 ones, 5 tenths and 60 hundredths = 88.10\n(b)\t \t12 tens and 12 tenths\n(c)\t \t10 tens, 10 ones, 10 tenths, and 10 hundredths\n(d)\t \t25 tens, 25 ones, 25 tenths, and 25 hundredths\n15.\tUsing each digit 0 – 9 not more than once, fill the boxes below so\nthat the sum is closest to 10.5:\n16.\tWrite the following fractions in decimal form:\n(a)\t 1\n(b)\t 3\n(c)\t 1\n(d)\t 3\n(e)\t 1\n(f)\t 4\n•\t We can split a unit into smaller parts to get more exact/accurate\nmeasurements.\n•\t We extended the Indian place value system and saw that\n»\n1 unit = 10 one-tenths,\n»\n1 tenth = 10 one-hundredths,\n»\n1 hundredth = 10 one-thousandths,\n»\n10 one-hundredths = 1 tenth,\n»\n100 one-hundredths = 1 unit.\n•\t A decimal point (‘.’) is used in the Indian place value system to separate\nthe whole number part of a number from its fractional part.\n•\t We also learnt how to compare decimal numbers, locate them on the\nnumber line, and perform addition and subtraction on them.\nSUMMARY\nTry\nThis\nPage No. 47\nWrite the measurements of the objects shown in the picture.\nAns:\nEraser → 2 4\n10  cm, Pencil → 4 5\n10  cm → 4 1\n2  cm, Chalk → 1 4\n10  𝑐𝑚\nPage No. 49\nArrange the lengths in increasing order:\n(a)\n(b) 1\n(c)\n(d) 13\n(e) 10\n(f) 7\n(g) 6\n(h)\nAns:\n10,\n10 , 1\n10 , 6\n10 , 7\n10 , 10\n10 ,\n10  , 13\nChapter – 3\nA Peek Beyond the Point\nPage No. 50\nArrange the following lengths in increasing order: 4\n10 ,\n10 ,\n10 , 41\nAns:\nIncreasing order:\n10 ,\n10 = 4\n10 , 41\nPage No. 51\nThe lengths of the body parts of a honeybee are given. Find its total\nlength.\nHead =  2 3\n10  units\nThorax =  5 4\n10  units\nAbdomen =  7 5\n10  units\nAns: 15\n10 units.\nPage No. 52\nA Celestial Pearl Danio’s length is  𝟐\n𝟏𝟎 cm, and the length of a\nPhilippine Goby is\n𝟏𝟎 cm. What is the difference in their lengths?\nAns: 1\n10  cm\nObserve the given sequences of numbers. Identify the change after\neach term and extend the pattern:\n(a) 4, 4\n𝟏𝟎, 4\n𝟏𝟎,\n_______, _______, _______, _______\n(b) 8\n𝟏𝟎, 8\n𝟏𝟎, 9\n𝟏𝟎,\n_______, _______, _______, _______\n(c) 7\n𝟏𝟎, 8\n𝟏𝟎,\n_______, _______, _______, _______\n(d) 5\n𝟏𝟎, 5\n𝟏𝟎,\n_______, _______, _______, _______\n(e) 13\n𝟏𝟎, 13, 12\n𝟏𝟎, _______, _______, _______, _______\n(f)\n𝟏𝟎, 10\n𝟏𝟎, 9\n𝟏𝟎, _______, _______, _______, _______\nAns:\n(a) 4, 4 3\n10 , 4 6\n10 , 4 9\n10 , 5 2\n10 , 5 5\n10 , 5 8\n10 → increment of 3\n10  each time.\n(b) 8 2\n10 , 8 7\n10 , 9 2\n10 , 9 7\n10 , 10 2\n10 , 10 7\n10 , 11 2\n10 →increment of 5\n10  each time.\n(c) 7 6\n10 , 8 7\n10 , 9 8\n10 , 10 9\n10 , 12, 13 1\n10 →increment of 1 + 1\n(d) 5 7\n10 , 5 3\n10 , 4 9\n10 , 4 5\n10 , 4 1\n10 , 3 7\n10 →subtracting: 4\n10  each time\n(e) 13 5\n10 , 13 , 12 5\n10 , 12, 11 5\n10 , 11, 10 5\n10 →decreasing by 5\n(f) 11 5\n10 , 10 4\n10 , 9 3\n10 , 8 2\n10 , 7 1\n10 , 6  → decreasing by 1 1\nPage No. 53\nHow many one‑hundredths make one‑tenth? Can we also say that\nthe length is 4 units and 45 one‑hundredths?\nAns:\n10 =\nSo, 10 one‑hundredths make one‑tenth.\nYes, we can write it 4 +\n100 = 4 units and 45 one‑hundredths.\nPage No. 54\nObserve\nthe\nfigure\nbelow.\nNotice\nthe\nmarkings\nand\nthe\ncorresponding lengths written in the boxes when measured from 0.\nFill the lengths in the empty boxes.\nAns:\nFor the lengths shown below write the measurements and read out\nthe measures in words.\nAns:\nMeasurement −5 37\nIn words: Five and thirtyseven-hundredths.\nMeasurement −15 3\nIn words: Fifteen and three-hundredths.\nPage No. 55\nMeasurement −7 52\nIn words: Seven and fiftytwo-hundredths.\nMeasurement −9 80\nIn words: Nine and eighty-hundredths.\nIn each group, identify the longest and the shortest lengths. Mark\neach length on the scale.\nAns:\n(a)  Longest =\nShortest =\n(b) Longest = 3\nShortest = 1\n(c) Longest =\nShortest =\n(d) Longest = 3\n100           Shortest = 3 6\nPage No. 56\n(e) Longest = 1\nShortest =\n(f) Longest = 7\nShortest = 7\n(g) Longest =\nShortest = 5\nPage No. 58\nFigure it Out\nFind the sums and differences\n(a)\n10 + 3\nAns: 3\n(b) 9\n100 + 2\nAns: 11\n(c) 15\n100 + 14\nAns: 30\n(d) 7\n100 – 4\nAns: 3\n(e) 8\n100 – 5\nAns: 3\n(f) 12\n100 –\nAns: 11\nPage No. 63\nMake a place value table similar to the one above. Write each\nquantity in decimal form and in terms of place value, and read the\nnumber:\nAns:\nQuestion\nHundreds\nTens\nOnes\nTenths\nHundredths\nThousandth\nDecimal\nForm\nRead as\na\n2 ones, 3\ntenths and 5\nhundredths\n–\n–\n–\n2 +\n10 +\n= 2.35\nTwo point\nthree five (or\ntwo and\nthirty-five\nhundredths)\nb\n1 ten and 5\ntenths\n–\n–\n–\n–\n10 +\n10 = 10.5\nTen point\nfive (or ten\nand five\ntenths)\nc\n4 ones and\nhundredths\n–\n–\n–\n–\n4 + 0 +\n= 4.06\nFour point\nzero six (or\nfour and six\nhundredths)\nd\n1 hundred,\n1 one and 1\nhundredth\n–\n–\n–\n100 + 0 + 1 + 0 +\n=101.01\nOne hundred\none point\nzero one (or\none hundred\none and one\nhundredth)\ne\n100 and\n–\n–\n–\n–\n10 +\n= 0.98\nZero point\nnine eight\n(or ninety-\neight\nhundredths)\nPage No. 64\nWrite these quantities in decimal form:\n(a) 234 hundredths\nAns: 2.34\n(b) 105 tenths.\nAns: 10.5\nf\n–\n–\n–\n–\n100 = 0.05\nZero point\nzero five (or\nfive\nhundredths)\ng\n–\n–\n–\n–\n–\n10 = 0.1\nZero point\none (or one\ntenth)\nh\n10, 4\n10,\nand 7\n–\n-\n–\n-\n-\n-\n2.01\n4 + 1\n10 = 4.1\n7 + 0\n10 + 0\n100 +\n= 7.007\nTwo point\nzero one\nand\nFour point\none\nand\nSeven point\nzero zero\nseven\n13.117\nThirteen\npoint one\none seven.\nFill in the blanks below (mm < – > cm)\nAns:\n12 mm= 1.2 cm\n56 mm = 5.6 cm\n70 mm = 7.0 cm\n9 mm = 0.9 cm\n134 mm = 13.4 cm\n2036 mm = 203.6 cm\nPage No. 66\nFill in blanks (cm <-> m):\n36 cm = 0.36 m\n50 cm = 0.5 m\n89 cm = 0.89 m\n4 cm = 0.04 m\n325 cm = 3.25 m\n207 cm = 2.07 m\nHow many mm does 1 meter have?\nAns: 1m = 1000 mm\nCan we write 1 mm =\n𝟏𝟎𝟎𝟎 m?\nAns: Yes\nPage No. 68\nFill in the blanks below (g < – > kg)\nAns:\n465 g = 0.465 kg\n68 g = 0.068 kg\n1560 g = 1.56 kg\n704 g = 0.704 kg\n560 g = 0.56 kg\n2500 g = 2.5 kg\nPage No. 69\nFill in the blanks below (rupee < – > paise)\n10 p = ₹0.10\n5 p = ₹0.05\n36 p = ₹0.36\n50 p = ₹0.50\n99 p = ₹0.99\n250 p = ₹2.50\nPage No. 70\nName all the divisions between 1 and 1.1 on the number line.\nAns: The small divisions between 1 and 1.1 on the number line (if the sub-\ndivision is of 10 parts) are: 1.01, 1.02, 1.03, 1.04, 1.05, 1.06, 1.07, 1.08, 1.09\nIdentify and write the decimal numbers against the letters.\nAns:\nPage No. 71\nCan you tell which of these is the smallest and which is the largest?\nAns:\nDecimal Number\nUnits\nTenths\nHundredths\nThousandths\n0.2\n0.20\n0.200\n0.02\n0.002\n0.2 = 0.20 = 0.200 is the largest.\n0.002 is the smallest.\nWhich of these are the same: 4.5, 4.05, 0.405, 4.050, 4.50, 4.005, 04.50?\nAns: 4.5, 4.50, and 04.50 are equal.\n4.05 and 4.050 are equal.\nIdentify the decimal number in the last number line in Figure (b)\ndenoted by ‘?’\nAns:\nMake such number lines for the decimal numbers: (a) 9.876 (b) 0.407.\nAns:\n(a)\n(b)\nIn the number line shown below, what decimal numbers do the boxes\nlabelled ‘a’, ‘b’, and ‘c’ denote?\nAns:\nPage No. 72\nUsing similar reasoning find out the decimal numbers in the boxes\nbelow.\nAns:\nPage No. 73\nWhich decimal number is greater?\n(a) 1.23 or 1.32 (b) 3.81 or 13.800 (c) 1.009 or 1.090\nAns:\n(a) 1.32 is larger.\n(b) 13.800 is larger.\n(c) 1.090 is larger.\nConsider the decimal numbers 0.9, 1.1, 1.01 and 1.11\nWhich of the above is closest to 1.09?\nAns: 1.1 is closest to 1.09.\nWhich among these is closest to 4: 3.56, 3.65, 3.099?\nAns: 3.65 is closest to 4.\nWhich among these is closest to 1: 0.8, 0.69, 1.08?\nAns: 1.08 is closest to 1.\nIn each case below use the digits 4, 1, 8, 2, and 5 exactly once and try\nto make a decimal number as close as possible to 25.\nAns:\nPage No. 75\nFigure it Out\n1. Find the sums\n(a) 5.3 + 2.6\n(b) 18 + 8.8\n(c) 2.15 + 5.26\n(d) 9.01 + 9.10\n(e) 29.19 + 9.91\n(f) 0.934 + 0.6\n(g) 0.75 + 0.03\n(h) 6.236 + 0.487\nAns:\n(a) 7.9\n(b) 26.8\n(c) 7.41\n(d) 18.11\n(e) 39.10\n(f) 1.534\n(g) 0.78\n(h) 6.723\n2. Find the differences\n(a) 5.6 – 2.3\n(b) 18 – 8.8\n(c) 10.4 – 4.5\n(d) 17 – 16.198\n(e) 17 – 0.05\n(f) 34.505 – 18.1\n(g) 9.9 – 9.09\n(h) 6.236 – 0.487\nAns:\n(a) 3.3\n(b) 9.2\n(c) 5.9\n(d) 0.802\n(e) 16.95\n(f) 16.405\n(g) 0.81\n(h) 5.749\nContinue this sequence 4.4, 4.8. 5.2, 5.6, 6.0, … and write the next 3\nterms.\nAns: 4.4, 4.8. 5.2, 5.6, 6.0, 6.4, 6.8, 7.2\nPage No. 76\nSimilarly, identify the change and write the next 3 terms for each\nsequence given below.\nTry to do this computation mentally.\n(a) 4.4, 4.45, 4.5,  …\n(b) 25.75, 26.25, 26.75,  …\n(c) 10.56, 10.67, 10.78, …\n(d) 13.5, 16, 18.5, …\n(e) 8.5, 9.4, 10.3, …\n(f) 5, 4.95, 4.90, …\n(g) 12.45, 11.95, 11.45, …\n(h) 36.5, 33, 29.5, …\nAns:\n(a) 4.4, 4.45, 4.5,4.55, 4.6, 4.65 → increment of + 0.05\n(b) 25.75, 26.25, 26.75, 27.25, 27.75, 28.25 → add 0.5\n(c) 10.56, 10.67, 10.78, 10.89, 11.0, 11.11→ Add 0.11\n(d) 13.5, 16, 18.5, 21.0, 23.5, 26.0 → Add 2.5\n(e) 8.5, 9.4, 10.3, 11.2, 12.1, 13.0  → Add 0.9\n(f) 5, 4.95, 4.90, 4.85, 4.80, 4.75 → Subtract 0.05\n(g) 12.45, 11.95, 11.45, 10.95, 10.45, 9.95 → Subtract 0.50\n(h) 36.5, 33, 29.5, 26.0, 22.5, 19.0 → Subtract 3.5\nPage No. 78\nFigure it out\n1. Convert the following fractions into decimals:\n(a)\n(b)\n(c)\n(d)\nAns:\n(a)\n100 = 0.05\n(b)\n1000 = 0.016\n(c)\n10 = 1.2\n(d)\n1000 = 0.254\nPage No. 79\n2.   Convert the following decimals into a sum of tenths, hundredths\nand thousandths:\n(a) 0.34\n(b) 1.02\n(c) 0.8\n(d) 0.362\nAns:\n(a)\n10 +\n(b)\n100 +\n100 = 1 +\n(c)\n(d)\n10 +\n100 +\n3.  What decimal number does each letter represent in the number\nline below?\nAns:\n4. Arrange the following quantities in descending order:\n(a) 11.01, 1.011, 1.101, 11.10, 1.01\n→ Descending order: 11.10, 11.01, 1.101, 1.011, 1.01.\n(b) 2.567, 2.675, 2.768, 2.499, 2.698\n→ Descending order: 2.768, 2.698, 2.675, 2.567, 2.499.\n(c) 4.678 g, 4.595 g, 4.600 g, 4.656 g, 4.666 g\n→Descending order: 4.678, 4.666, 4.656, 4.600, 4.595.\n(d) 33.13 m, 33.31 m, 33.133 m, 33.331 m, 33.313 m\n→ Descending order: 33.331, 33.313, 33.31, 33.133, 33.13.\n5.  Using the digits 1, 4, 0, 8, and 6 make: (a) the decimal number\nclosest to 30 (b) the smallest possible decimal number between\n100 and 1000.\nAns: Using the digits 1, 4, 0, 8, and 6, we can make:\n(a) 40.168\n(b) 104.68\n6. Will a decimal number with more digits be greater than a\ndecimal number with fewer digits?\nAns:  No. It is not necessary. For example, 2.05 (2 digits after decimal) vs\n2.5 (1 digit after decimal).  2.5 >2.05\n7. Mahi purchases 0.25 kg of beans, 0.3 kg of carrots, 0.5 kg of potatoes,\n0.2 kg of capsicums, and 0.05 kg of ginger. Calculate the total\nweight of the items she bought.\nAns:  1.3 kg\n8. Pinto supplies 3.79 L, 4.2 L, and 4.25 L of milk to a milk dairy in the\nfirst three days. In 6 days, he supplies 25 liters of milk. Find the\ntotal quantity of milk supplied to the dairy in the last three days.\nAns: 12.76 L\n9. Tinku weighed 35.75 kg in January and 34.50 kg in February. Has\nhe gained or lost weight? How much is the change?\nAns:  He has lost weight. The change in the weight = 1.25 kg\n10. Extend the pattern: 5.5, 6.4, 6.39, 7.29, 7.28, 8.18, 8.17, ____, _____\nAns: 9.07, 9.06\n11. How many millimeters make 1 kilometer?\nAns: 1000000 mm\n12. Indian Railways offers optional travel insurance for passengers\nwho book e-tickets. It costs 45 paise per passenger. If 1 lakh\npeople opt for insurance in a day, what is the total insurance fee\npaid?\nAns: The total insurance fee paid for 1 lakh passengers is ₹45,000.\n13. Which is greater?\n(a)\n𝟏𝟎𝟎𝟎 or\n𝟏𝟎?\n(b) One-hundredth or 90 thousandths?\n(c) One-thousandth or 90 hundredths?\nAns:\n(a)\n10 >\n(b) 90 thousandths > One-hundredth\n(c) 90 hundredths > One-thousandth\nPage No. 80\n14. Write the decimal forms of the quantities mentioned (an\nexample is given):\n(a) 87 ones, 5 tenths and 60 hundredths\n(b) 12 tens and 12 tenths\n(c) 10 tens, 10 ones, 10 tenths, and 10 hundredths\n(d) 25 tens, 25 ones, 25 tenths, and 25 hundredths\nAns:\n(a) 88.10\n121.2\n(b) 111.1\n277.75\n15. Using each digit 0 – 9 not more than once, fill the boxes below so\nthat the sum is closest to 10.5:\nAns:\n16. Write the following fractions in decimal form:\n(a)\n(b)\n(c)\n(d)\n(e)\n(f)\nAns:\n(a) 0.5\n(b) 1.5\n(c) 0.25\n(d) 0.75\n(e) 0.2\n(f) 0.8",
  "content_length": 17392
}

data/intermediate/markdown/grade11/physics/part1/chapter6.md

## 6.4 LINEAR MOMENTUM OF A SYSTEM OF PARTICLES

$$
\frac {\mathrm{d} \mathbf {P}}{\mathrm{d} t} = \mathbf {F} _ {e x t}\tag{6.17}
$$

$$
\frac {\mathrm{d} \mathbf {P}}{\mathrm{d} t} = 0 \quad \text {or} \quad \mathbf {P} = \text {Constant}\tag{6.18a}
$$

## An experiment with the bicycle rim

$$
\frac {\mathrm{d} \mathbf {P}}{\mathrm{d} t} = \mathbf {F} _ {e x t}\tag{6.17}
$$

## 6.8.2 Centre of gravity

Example 6.8 A metal bar 70 cm long and 4.00 kg in mass supported on two knife-edges placed 10 cm from each end. A 6.00 kg load is suspended at 30 cm from one end. Find the reactions at the knife-edges. (Assume the bar to be of uniform cross section and homogeneous.)

$= 30 \mathrm{~cm}, \mathrm{PG} = 5 \mathrm{~cm}, \mathrm{AK}_{1} = \mathrm{BK}_{2} = 10 \mathrm{~cm}$ and $\mathrm{K}_{1} \mathrm{G} = \mathrm{K}_{2} \mathrm{G} = 25 \mathrm{~cm}$. Also, $W =$ weight of the rod $= 4.00 \mathrm{~kg}$ and $W_{1} =$ suspended load $= 6.00 \mathrm{~kg}; R_{1}$ and $R_{2}$ are the normal reactions of the support at the knife edges.

It is given that  $W = 4.00g N$  and  $W_{1} = 6.00g N$ , where g = acceleration due to gravity. We take  $g = 9.8 m/s^{2}$ .

## 6.11 DYNAMICS OF ROTATIONAL MOTION ABOUT A FIXED AXIS

$$
\mathrm{d} W = \tau \mathrm{d} \theta\tag{6.39}
$$

## EXERCISES

6.9 A car weighs 1800 kg. The distance between its front and back axles is 1.8 m. Its centre of gravity is 1.05 m behind the front axle. Determine the force exerted by the level ground on each front wheel and each back wheel.